text	target	condition
Mutungamiri we nyika ye South Africa , Va Cyril Ramaphosa , nemusi we China vakadoma nhumwa mbiri kuti dziende ku Zimbabwe uko kuri kunzi kwaberekera ingwe kuchityorwa kodzero dze vanhu ne hurumende .	NOUN ADP NOUN ADP PROPN PROPN PUNCT NOUN PROPN PROPN PUNCT NOUN ADP NOUN VERB NOUN NUM DET VERB ADP PROPN ADV AUX VERB VERB NOUN VERB NOUN ADP NOUN ADP NOUN PUNCT	sna
Vakadomwa kuenda ku Zimbabwe ndevaimbove mutevedzeri we mutungamiri we nyika ye South Africa , uye vakambovewo mutauriri we dare re paramende , Amai Baleka Mbete uye gurukota rezve vasori mu South Africa , Va Sydney Mufamadi .	VERB VERB ADP PROPN VERB NOUN ADP NOUN ADP NOUN ADP PROPN PROPN PUNCT CCONJ VERB NOUN ADP NOUN ADP NOUN PUNCT NOUN PROPN PROPN CCONJ NOUN ADP NOUN ADP PROPN PROPN PUNCT NOUN PROPN PROPN PUNCT	sna
Paitawo ropa rakaipa pakati pe Zanu - PF ne ANC zvopa kuti pakandiranwe makobvu ne matete .	VERB NOUN ADJ ADP ADP PROPN PUNCT PROPN CCONJ PROPN VERB DET VERB ADJ CCONJ ADJ PUNCT	sna
Vaive mutungamiri we nyika ye Botswana , Va Ian Khama , vatiwo vari kushushikana ne nyaya iri kupomerwa Zimbabwe ye kutyora kodzero dze vanhu .	AUX NOUN ADP NOUN ADP PROPN PUNCT NOUN PROPN PROPN PUNCT VERB AUX VERB ADP NOUN AUX VERB PROPN ADP VERB NOUN ADP NOUN PUNCT	sna
Mukuru anoona nezve kuburitswa kwe mashoko mu Zanu - PF , Va Tafadzwa Mugwadi vanoti se bato re Zanu PF vanotambira ne mufaro danho ratorwa na Va Ramaphosa re kutumira nhumwa vachiti izvi zvichaburitsa pachena manyepo ose anga achiburitswa pa madandemutande ekuti mu Zimbabwe hamuna kugadzikana , hamuna runyararo .	NOUN VERB ADP VERB ADP NOUN ADP PROPN PUNCT PROPN PUNCT NOUN PROPN PROPN VERB ADV NOUN ADP PROPN PROPN VERB ADP NOUN NOUN VERB ADP NOUN PROPN ADP VERB NOUN VERB DET VERB ADV NOUN DET AUX VERB ADP NOUN DET ADP PROPN ADV VERB PUNCT ADV NOUN PUNCT	sna
Asi munyori anoona nezve kudyidzana ne dzimwe nyika mubato re MDC Alliance , Muzvare Gladys Hlatywayo , vanoti se bato re MDC Alliance inotungamirirwa na Va Nelson Chamisa , vatambira mashoko ari kubva ku South Africa ekuti vangabatsira sei matambudziko ari mu Zimbabwe .	SCONJ NOUN VERB ADP VERB ADP DET NOUN NOUN ADP PROPN PROPN PUNCT NOUN PROPN PROPN PUNCT VERB ADV NOUN ADP PROPN NOUN VERB ADP NOUN PROPN PROPN PUNCT VERB NOUN AUX VERB ADP PROPN PROPN DET VERB ADV NOUN AUX ADP PROPN PUNCT	sna
Gurukota rinoona nezve vashandi Amai Sekai Nzenza varamba nyaya yekuti vakapihwa mari ye chiokomuhomwe ne gurukota rezve kushanyirwa kwe nyika Amai Prisca Mupfumira avo vari kupomerwa mhosva dze huori .	NOUN VERB ADP NOUN NOUN PROPN PROPN VERB NOUN DET VERB NOUN ADP NOUN ADP NOUN ADP VERB ADP NOUN NOUN PROPN PROPN PRON AUX VERB NOUN ADP NOUN PUNCT	sna
Izvi zvinotevera kunonoka kuburitsa gwaro re huori hunonzi hwakaitika ku National Social Security Authority kana kuti NSSA kwakaitwa ne bazi rinotungamirwa na Amai Nzenza .	DET VERB VERB VERB NOUN ADP NOUN VERB VERB ADP NOUN NOUN NOUN NOUN CCONJ DET PROPN VERB ADP NOUN VERB ADP NOUN PROPN PUNCT	sna
Kunonoka kuburitsa gwaro iri kwaunza mutauro mu nyika .	VERB VERB NOUN DET VERB NOUN ADP NOUN PUNCT	sna
Vachitaura ne vatori ve nhau mu Harare nhasi , sachigaro we bhodhi re National Social Security Authority Va Cuthbert Chidoori vatiwo gwaro re ongororo yakaitwa ku NSSA richabuditswa mu nguva pfupi iri kutevera .	VERB ADP NOUN ADP NOUN ADP PROPN ADV PUNCT NOUN ADP NOUN ADP NOUN NOUN NOUN NOUN NOUN PROPN PROPN VERB NOUN ADP NOUN VERB ADP PROPN VERB ADP NOUN ADJ DET VERB PUNCT	sna
Pambenge paitawo ropa rakaipa pakati pe dare re paramande na Amai Nzenza avo vange vachitsika madziro kuti gwaro iri riburitswe sezvo vaiti magweta avo achiri kuripenengura uye vanoda nguva .	AUX ADV NOUN ADJ ADP ADP NOUN ADP NOUN ADP NOUN PROPN PRON AUX VERB ADJ DET NOUN DET VERB SCONJ VERB NOUN PRON AUX VERB CCONJ VERB NOUN PUNCT	sna
Vane ruzivo ne zviri kuitika ku NSSA vanoti gwaro iri rinobuditsa pachena kusafambiswa zvakanaka kwe mari dze NSSA .	DET NOUN ADP AUX VERB ADP PROPN VERB NOUN DET VERB ADV VERB ADJ ADP NOUN ADP PROPN PUNCT	sna
Zvichakadaro , munyori mukuru we ZCTU Va Japhet Moyo vanoti sangano ravo harisi kufara ne kunonoka kuri kuitwa kuburitswa kwe gwaro re ongororo yakaitwa ku NSSA vachiti vave kutoronga zve kukwidza Amai Nzenza ku matare .	ADV PUNCT NOUN ADJ ADP PROPN NOUN PROPN PROPN VERB NOUN PRON ADV VERB ADP VERB AUX VERB VERB ADP NOUN ADP NOUN VERB ADP PROPN VERB AUX VERB ADP VERB NOUN PROPN ADP NOUN PUNCT	sna
Zvichakadai , sachigaro we ZACC , Amai Loice Matanda Moyo varamba mashoko ari kutenderera pa social media ekuti vaimbove gurukota rezve migodhi , Va Obert Mpofu , vasungwa ne komisheni yavo .	ADV PUNCT NOUN ADP PROPN PUNCT NOUN PROPN PROPN PROPN VERB NOUN AUX VERB ADP ADJ NOUN DET AUX NOUN ADP NOUN PUNCT NOUN PROPN PROPN PUNCT VERB ADP NOUN PRON PUNCT	sna
Amai Moyo varamba kutaura zvakawanda nezve kuferefetwa kunonzi kuri kuitwa Va Mpofu vachiti kana izvi zviri kuitika hazvisi zvinhu zvingataurwe ku vatori ve nhau .	NOUN PROPN VERB VERB ADJ ADP VERB VERB AUX VERB NOUN PROPN VERB SCONJ DET AUX VERB ADV NOUN VERB ADP NOUN ADP NOUN PUNCT	sna
Vane ruzivo ne zviri kuitika ku Zacc vanoti Va Mpofu vari kuferefetwa ne komisheni iyi ne nyaya dzine chekuita ne mangoda ekwa Chiyadzwa .	DET NOUN ADP AUX VERB ADP PROPN VERB NOUN PROPN AUX VERB ADP NOUN DET ADP NOUN AUX ADV ADP NOUN ADP PROPN PUNCT	sna
Mutevedzeri we mutungamiri we kambani ye US Africa Cybersecurity , Amai Priscilla Mutembwa , vari kukurudzira vabereki kuti vakoshese uye kukurudzira vana vachiri vadiki , zvikuru vanasikana kuti vafarire zvidzidzo zve Science , Technology ne Mathematics ( STEM ) sezvo kune madzimai mashoma ari kuita mabasa ane chekuita ne zvidzidzo izvi .	NOUN ADP NOUN ADP NOUN ADP PROPN PROPN PROPN PUNCT NOUN PROPN PROPN PUNCT AUX VERB NOUN DET VERB CCONJ VERB NOUN AUX ADJ PUNCT ADV NOUN DET VERB NOUN ADP NOUN PUNCT NOUN CCONJ NOUN PUNCT PROPN PUNCT ADV ADV NOUN ADJ AUX VERB NOUN AUX ADV ADP NOUN DET PUNCT	sna
Amai Mutembwa vakapa kurudziro iyi pa musangano wakarongwa na meya we guta re Washington DC , Amai Muriel Bowser , Muvhuro manheru mu guta iri .	NOUN PROPN VERB VERB DET ADP NOUN VERB ADP NOUN ADP NOUN ADP PROPN PROPN PUNCT NOUN PROPN PROPN PUNCT NOUN ADJ ADP NOUN DET PUNCT	sna
Vamwe vanyarikani vange vakamirira Amai Bowser vakaudza musangano uyu kuti guta re Washington DC riri mushishi me kuyedza kuwedzera huwandu hwe avo vanoita mabasa anoita ne STEM nyaya madzimai uye vari kuda kuwedzera zvirongwa zvinokurudzira zvidzidzo izvi .	DET NOUN AUX VERB NOUN PROPN VERB NOUN DET DET NOUN ADP PROPN PROPN AUX NOUN ADP VERB VERB NOUN ADP PRON VERB NOUN ADV ADP PROPN NOUN NOUN CCONJ AUX VERB VERB NOUN VERB NOUN DET PUNCT	sna
Amai Mutembwa vanoti zvakakosha kuti vanhu varemekedze kuchengetedzwa kwe zvavanoburitsa pa dandemutande izvo zvinoitwa pasi pe chirongwa che Cyber security sezvo vanhu vazhinji vave kugara vari pa mafoni ne macomputer izvo zvinozokwanisa kuti vabirwe zvine chekuita ne hupenyu hwavo kana zvisina kuchengetedzwa .	NOUN PROPN VERB ADJ DET NOUN VERB VERB ADP VERB ADP NOUN PRON VERB ADP ADP NOUN ADP NOUN NOUN SCONJ NOUN ADJ AUX VERB AUX ADP NOUN CCONJ NOUN ADV VERB DET VERB AUX VERB ADP NOUN PRON SCONJ ADV VERB PUNCT	sna
Vazhinji vanoshandisa nharembozha kutumira mari ne kuwana mari ne zvimwewo vachishandisa technology iyo inofanirwa kunge yakachengetedzwa kuitira kuti makoronyera asazoba zvinechekuita ne vanenge vachishandisa nhare kana macomputers kana akadzivirirwa cyber security , Amai Mutembwa vakaudza Marvellous Mhlanga - Nyahuye we VOA .	ADJ VERB NOUN VERB NOUN ADP VERB NOUN CCONJ ADV VERB NOUN PRON AUX AUX VERB ADV DET NOUN VERB ADV ADP AUX VERB NOUN CCONJ NOUN CCONJ VERB NOUN NOUN PUNCT NOUN PROPN VERB PROPN PROPN PUNCT PROPN ADP PROPN PUNCT	sna
Zvimwe zvizvarwa zve Zimbabwe zviri kunze kwe nyika zviri kukurudzira hurumende kuti igadzirise ne kukasika matambudziko akatarisana ne nyika mune zve upfumi , zvichiti matambudziko aya ave kuzviita kuti zviwedzere kuremerwa ne mutoro wekuchengeta hama ne shamwari kumusha .	DET NOUN ADP PROPN AUX ADJ ADP NOUN AUX VERB NOUN DET VERB ADP ADJ NOUN VERB ADP NOUN ADP ADP NOUN PUNCT VERB NOUN PRON AUX VERB DET VERB VERB ADP NOUN VERB NOUN CCONJ NOUN NOUN PUNCT	sna
Mumwe we vana ve Zimbabwe vari kunze kwe nyika vari kuti kusagadzikana kwe zvinhu ku musha kwave kuvaomera , nda Amai Chenaimwoyo Mutambasere , avo vari ku Britain .	PRON ADP NOUN ADP PROPN AUX ADJ ADP NOUN AUX DET VERB ADP NOUN ADP NOUN AUX VERB PUNCT AUX NOUN PROPN PROPN PUNCT PRON AUX ADP PROPN PUNCT	sna
Amai Mutambasere vanoti chave kuremedza vakawanda vari kunze inyaya yekuti havachatarisirwa kungobatsira hama ne shamwari dzavo chete , asiwo kubatsira veruzhinji kuburikidza nekubatsira mukutsvagwa kwe zvinhu zvakawanda zvinosanganisira mishonga ye kushandisa muzvipatara zvinorapa veruzhinji .	NOUN PROPN VERB ADV VERB ADJ PRON ADJ NOUN DET ADV VERB NOUN CCONJ NOUN PRON ADV PUNCT SCONJ VERB NOUN ADP VERB VERB ADP NOUN ADJ ADV NOUN ADP VERB NOUN VERB ADJ PUNCT	sna
Vanotiwo vana ve Zimbabwe vari kunze kwe nyika vagara vaine bandiko guru kwazvo mune zveupfumi hwe nyika kuburikidza ne mari dzavanotumira .	VERB NOUN ADP PROPN AUX ADJ ADP NOUN VERB AUX NOUN ADJ ADJ ADP NOUN ADP NOUN ADV ADP NOUN VERB PUNCT	sna
Matambudziko ari kutarisana ne nyika pari zvino anosanganisira kukwira kwe mitengo ye zvinhu , kushaikwa kwe mafuta e dzimotokari , pamwe nekushaikwa kwe mari ye kunze .	NOUN AUX VERB ADP NOUN ADP ADV VERB VERB ADP NOUN ADP NOUN PUNCT VERB ADP NOUN ADP NOUN PUNCT CCONJ VERB ADP NOUN ADP NOUN PUNCT	sna
Amai Mutambasere vanoti chave kudiwa mu nyika iye zvino kuvandudzwa kwe nyaya dzezve matongerwo e nyika kuitira kuti vari kunze vave ne chivimbo che kudyara mari dzavo mu nyika .	NOUN PROPN VERB AUX VERB ADP NOUN ADV ADV VERB ADP NOUN ADP NOUN ADP NOUN VERB DET PRON ADJ AUX ADP NOUN ADP VERB NOUN DET ADP NOUN PUNCT	sna
Vanoti chikuru chave kudiwa ndechekuti vana ve Zimbabwe vese vabatane vatsvage nzira dze kugadzirisa nadzo matambudziko aya kuitira kuti nyika ifambire mberi .	VERB NOUN AUX VERB AUX NOUN ADP PROPN DET VERB VERB NOUN ADP VERB PRON NOUN DET VERB DET NOUN VERB ADV PUNCT	sna
Mutungamiri we nyika Va Emmerson Mnangagwa nezuro ne musi we Chitatu vakatumira gurukota rinoona nezve mukati me nyika Va Ziyambi Ziyambi kuti ritsanangurire dare kuti sei vakatumira mauto kunodzivirira mhirizhonga muna Ndira .	NOUN ADP NOUN NOUN PROPN PROPN NOUN ADP NOUN ADP NOUN VERB NOUN VERB ADP NOUN ADP NOUN NOUN PROPN PROPN DET VERB NOUN DET ADV VERB NOUN VERB NOUN ADP PROPN PUNCT	sna
Bumbiro re mutemo rinosungira mutungamiri we nyika kuti asume dare re paramende nechimbi chimbi nezve danho rekushandisa mauto se zvakaitwa izvi .	NOUN ADP NOUN VERB NOUN ADP NOUN DET VERB NOUN ADP NOUN ADJ ADV ADP NOUN VERB NOUN ADV VERB DET PUNCT	sna
Va Mnangagwa vange vave ne mavhiki matanhatu vasina kuita izvi zvakapa kuti gweta , vari nhengo ye MDC Va Innocent Gonese vanomirira Mutare Central vakumbire dare kuti Va Mnangagwa vauye kuzotsanangura ku dare kuti sei vakatuma mauto kunomisa kuratidzira .	NOUN PROPN AUX AUX ADP NOUN NUM ADP VERB DET VERB DET NOUN PUNCT AUX NOUN ADP PROPN NOUN PROPN PROPN VERB PROPN NOUN VERB NOUN DET NOUN PROPN VERB VERB ADP NOUN DET ADV VERB NOUN VERB VERB PUNCT	sna
Va Goneso vati Va Mnangagwa havasi pamusoro pe mutemo ne dare vanofanira kutsanangurira dare kana vaita zvinhu zvakadai .	NOUN PROPN VERB NOUN PROPN ADV ADJ ADP NOUN ADP NOUN VERB VERB NOUN ADV VERB NOUN DET PUNCT	sna
Izvi ndizvo zvapa kuti Va Ziyambi vauye ku dare vachipa zvikonzero zvekuti zvainge zviri pachena kuti mapurisa ainge akurirwa ne vanhu vairatidzira ndokusaka vakakumbira kuti mauto apindire .	DET PRON VERB DET NOUN PROPN VERB ADP NOUN VERB NOUN ADV AUX AUX ADJ DET NOUN AUX VERB ADP NOUN VERB ADV VERB DET NOUN VERB PUNCT	sna
Masangano anorwira kodzero dze vanhu ari kupomera mauto ne mapurisa mhosva yekupfuura vanhu gumi ne vanomwe uye kubata mamwe madzimai chibharo .	NOUN VERB NOUN ADP NOUN AUX VERB NOUN CCONJ NOUN NOUN VERB NOUN NUM CCONJ NUM CCONJ VERB PRON NOUN NOUN PUNCT	sna
Asi hurumende iri kuramba nyaya iyi ichipomera bato re MDC ne vanopikisa mhosva yekuda kuipidigura .	CCONJ NOUN AUX VERB NOUN DET VERB NOUN ADP PROPN CCONJ VERB NOUN VERB VERB PUNCT	sna
Dare repamusorosoro re Supreme Court ne Chipiri rapa mutongo wekuti Va Nelson Chamisa havasi mutungamiri we bato re MDC ari pa mutemo .	NOUN ADJ ADP NOUN NOUN ADP PROPN VERB NOUN DET NOUN PROPN PROPN ADV NOUN ADP NOUN ADP PROPN AUX ADP NOUN PUNCT	sna
Mutongo uyu wave kureva kuti Muzvare Thokozane Khupe ndivo vanofanirwa kutungamira bato re MDC iri zvichitevera kushaya kwe vaimbove mutungamiri uye vakavamba bato iri , Va Morgan Tsvangirai , kusvika pasarudzwa mumwe mutungamiri .	NOUN DET AUX VERB DET NOUN PROPN PROPN AUX AUX VERB NOUN ADP PROPN DET ADP VERB ADP AUX NOUN CCONJ VERB NOUN DET PUNCT NOUN PROPN PROPN PUNCT ADP VERB PRON NOUN PUNCT	sna
Mutongo uyu waitwa zvichitevera kupikiswa kwakaitwa na Va Chamisa mutongo wakanga wapiwa ne dare re High Court gore rapera waiti Muzvare Khupe ndivo mutungamiri ari pa mutemo .	NOUN DET VERB ADV VERB VERB ADP NOUN PROPN NOUN AUX VERB ADP NOUN ADP NOUN NOUN NOUN ADJ VERB NOUN PROPN AUX NOUN AUX ADP NOUN PUNCT	sna
Dare repamusorosoro iri ratiwo bato re MDC rinofanirwa kuita musangano waro we kongiresi mukati mwemwedzi mitatu we kusarudza mutungamiri ari pa mutemo .	NOUN ADJ DET VERB NOUN ADP PROPN VERB VERB NOUN DET ADP NOUN ADP NOUN NUM ADP VERB NOUN AUX ADP NOUN PUNCT	sna
Gweta ra Muzvare Khupe , Muzvinafundo Lovemore Madhuku , vanoti vatambira ne mufaro mutongo we dare uyu .	NOUN ADP NOUN PROPN PUNCT NOUN PROPN PROPN PUNCT VERB VERB ADP NOUN NOUN ADP NOUN DET PUNCT	sna
Mutongo uyu tautambira zvakanaka nekuti zvataurwa ne Supreme Court ndo zvatagara tichitaura ku court ikoku .	NOUN DET VERB ADJ SCONJ VERB ADP NOUN NOUN AUX VERB VERB ADP NOUN DET PUNCT	sna
Isu tanga tichitaura tichiti Va Khupe ndivo chete vakaita president pakafa Va Tsvangirai nekuti ndivo vakanga vari Vice President wa Va Tsvangirai zvichienderana ne bumbiro re MDC , Va Madhuku vanodaro .	PRON AUX VERB VERB NOUN PROPN AUX ADJ VERB NOUN VERB NOUN NOUN SCONJ PRON AUX AUX ADJ NOUN ADP NOUN PROPN ADV ADP NOUN ADP PROPN PUNCT NOUN PROPN VERB PUNCT	sna
Vanoti zvave kureva kuti Muzvare Khupe vanofanirwa kuchitotanga kushandira ku muzinda we bato we Harvest House vachironga gadziriro yekuita extra - ordinary congress ye bato ravo mukati me mwedzi mitatu sezvatarwa ne dare .	VERB AUX VERB DET NOUN PROPN VERB VERB VERB ADP NOUN ADP NOUN ADP PROPN NOUN VERB NOUN VERB ADJ PUNCT ADJ NOUN ADP NOUN PRON ADP ADP NOUN NUM VERB ADP NOUN PUNCT	sna
Vachipawo mashoko avo ku vatori ve nhau mushure me mutongo uyu , vaive sachigaro ve bato munguva ya Va Tsvangirai , Va Morgen Komichi , vati vachatambira nekutevedzera mutongo uyu zvizere .	VERB NOUN DET ADP NOUN ADP NOUN ADP ADP NOUN DET PUNCT AUX NOUN ADP NOUN NOUN ADP NOUN PROPN PUNCT NOUN PROPN PROPN PUNCT VERB VERB VERB NOUN DET ADV PUNCT	sna
Va Komichi vatiwo mutongo uyu unoreva kuti vave kudzorera bato paraive riri muna 2018 , zvichireva kuti vese vakanga vaine zvigaro panguva iyi vanenge vadzokera pa zvigaro zvavo , uye vese vakange vadzingwa mubato kana kumbomiswa kushanda , vadzoserwa mubato zvizere .	NOUN NOUN VERB NOUN PRON VERB DET AUX VERB NOUN ADV AUX ADP NUM PUNCT VERB DET ADJ AUX AUX NOUN ADV DET AUX VERB ADP NOUN PRON PUNCT CCONJ ADJ AUX VERB NOUN CCONJ VERB VERB PUNCT VERB NOUN ADJ PUNCT	sna
Asi mumwe we vatevedzeri wa Va Chamisa , Va Tendai Biti , vanoti mutongo uyu hauna zvauri kushandura mubato ravo re MDC - Alliance , sezvo Va Chamisa vakasarudzwa ne vanhu ku kongiresi yakaitwa ne bato ravo .	SCONJ PRON ADP NOUN ADP NOUN PROPN PUNCT NOUN PROPN PROPN PUNCT VERB NOUN DET ADV AUX VERB NOUN PRON ADP PROPN PUNCT PROPN PUNCT CCONJ NOUN PROPN VERB ADP NOUN ADP NOUN VERB ADP NOUN DET PUNCT	sna
Hatineyi ne mutongo iwoyo uyu .	ADV ADP NOUN DET PRON PUNCT	sna
Isu tiri vanhu ve MDC Alliance inotungamirirwa na Va Chamisa , inove party yakafomwa na Va Tsvangirai vadaidza mapati six iyo MDC ichizoita yechi seven .	PRON AUX NOUN ADP PROPN PROPN VERB ADP NOUN PROPN PUNCT AUX NOUN VERB ADP NOUN PROPN VERB NOUN NUM DET PROPN VERB ADP NUM PUNCT	sna
MDC Alliance yakazozviita bato ndokuenda ku Congress muna May 2019 ndokusarudza vatungamiri vanoti Va Chamisa as president , Amai Karenyi - Kore , Vice President ; Professor Welshman Ncube , Vice President ; Tendai Biti , Vice President ; Tabitha Khumalo , chairperson , pamwe nevamwe vatungamiri , Va Biti vanodaro .	PROPN PROPN VERB NOUN VERB ADP NOUN ADP PROPN NUM VERB NOUN DET NOUN PROPN ADV NOUN PUNCT NOUN PROPN PUNCT PROPN PUNCT ADJ PRON PUNCT NOUN PROPN PROPN PUNCT ADJ PRON PUNCT PROPN PROPN PUNCT ADJ NOUN PUNCT PROPN PROPN PUNCT NOUN PUNCT CCONJ PRON NOUN PUNCT NOUN PROPN VERB PUNCT	sna
Vanoti Muzvare Khupe vakapinda musarudzo ya 2018 se mutungamiri we bato re MDC - T mushure mekuitawo kongiresi ye bato ravo kwavasarudzwa se mutungamiri we bato pamwe ne vamwe vabati ve zvigaro .	VERB NOUN PROPN VERB NOUN ADP NUM ADV NOUN ADP NOUN ADP PROPN PUNCT PROPN ADJ VERB NOUN ADP NOUN PRON VERB ADV NOUN ADP NOUN CCONJ ADP PRON NOUN ADP NOUN PUNCT	sna
Pa nyaya ye midziyo ye bato , Va Biti vanoti ivo ndeve MDC Alliance , uye mutongo uyu unongoratidza chete kuti kune vamwe vavanga vachishanda navo ne vamwe vari kuda kuona kuti bato ravo raparara , asi vanoti izvo hazvigoneki nekuti ndezve vanhu , uye ndezva Mwari .	ADP NOUN ADP NOUN ADP NOUN PUNCT NOUN PROPN VERB PRON AUX PROPN PROPN PUNCT CCONJ NOUN DET VERB ADV DET AUX PRON AUX VERB PRON CCONJ PRON AUX VERB VERB DET NOUN PRON VERB PUNCT SCONJ VERB DET ADV SCONJ ADP NOUN PUNCT CCONJ ADP NOUN PUNCT	sna
Va Biti vanotiwo muzinda we bato we Morgan Richard Tsvangirai House kana kuti Harvest House hausi we bato re MDC nekudaro haukwanise kutorwa na Muzvare Khupe .	NOUN PROPN VERB NOUN ADP NOUN ADP PROPN PROPN PROPN NOUN CCONJ DET PROPN NOUN ADV ADP NOUN ADP PROPN SCONJ ADV VERB ADP NOUN PROPN PUNCT	sna
Vakaremara vakawanda mu nyika vanoti havasi kufara ne kuwedzerwa kwakaitwa ne hurumende nguva yekuti vanhu varambe vari mu dzimba dzavo se nzira yekudzivirira chirwere che Coronavirus icho chauraya vanhu vakawanda pasi rose pamwe nekuparadza hupfumi hwe nyika dzakawanda .	NOUN ADJ ADP NOUN VERB ADV VERB ADP ADV VERB ADP NOUN NOUN DET NOUN VERB AUX ADP NOUN PRON ADV NOUN VERB NOUN ADP PROPN DET VERB NOUN ADJ NOUN ADJ CCONJ VERB NOUN ADP NOUN ADJ PUNCT	sna
Kunyange hazvo vakawanda ve vanhu vakaremara vachitsigira danho rakaitwa ne mutungamiri we nyika , Va Emmerson Mnangagwa , re kuwedzera nguva yekuti vanhu vagare mudzimba dzavo se nzira yekudzivirira kupararira kwe chirwere che Coronavirus , kugara vanhu vakazvivharira mudzimba uku kuri kuita kuti vakaremara , avo vanorarama ne nzira dzakasiyana siyana , vatadze kuzviriritira .	ADV CCONJ ADJ ADP NOUN ADJ VERB NOUN VERB ADP NOUN ADP NOUN PUNCT NOUN PROPN PROPN PUNCT ADP ADV NOUN DET NOUN VERB NOUN PRON ADV NOUN VERB VERB ADP NOUN ADP PROPN PUNCT VERB NOUN VERB NOUN DET AUX VERB DET NOUN PUNCT PRON VERB ADP NOUN ADJ ADJ PUNCT VERB VERB PUNCT	sna
Mutungamiri we sangano re National Council of Disabled Persons of Zimbabwe , Amai Farai Cherera , vanoti kumanikidzwa kuri kuitwa vanhu kuti vagare mudzimba dzavo kuri kusiya nhengo dze sangano ravo dziri parumananzombe , kuburikidza nekushaya cheuviri .	NOUN ADP NOUN ADP NOUN NOUN ADP NOUN NOUN ADP PROPN PUNCT NOUN PROPN PROPN PUNCT VERB VERB AUX VERB NOUN DET VERB NOUN PRON AUX VERB NOUN ADP NOUN PRON AUX NOUN PUNCT ADV VERB NOUN PUNCT	sna
Amai Cherera vanoti kunyange hazvo paine rubatsiro rwuri kupihwa vanhu munguva ino , chokwadi chiripo ndechekuti vakaremara vazhinji havasi kuwana zvinhu zve kuzvidzivirira kuti vasabatwe ne chirwere che Coronavirus , sezvo paine zvipingaidzo zviri kupa kuti vatadze kuwana rubatsiro urwu .	NOUN PROPN VERB ADV CCONJ AUX NOUN AUX VERB NOUN NOUN DET PUNCT NOUN ADV AUX NOUN ADJ ADV VERB NOUN ADP VERB DET VERB ADP NOUN ADP PROPN PUNCT ADV AUX NOUN AUX VERB DET VERB VERB NOUN DET PUNCT	sna
Mumwe we vanhu vasiri kuwana rubatsiro , Va George Mangwiro veku Hatcliff , avo vakaremara uye vachishandisa madondoro , vanotiwo mari dziri kupihwa vanotambura se rubatsiro ne hurumende kuitira kuti vanhu ava vabatsirike panguva ino , hadzisi kusvika kune vakaremara vakawanda .	PRON ADP NOUN ADV VERB NOUN PUNCT NOUN PROPN PROPN ADP PROPN PUNCT PRON ADJ CCONJ VERB NOUN PUNCT VERB NOUN AUX VERB NOUN ADV NOUN ADP NOUN VERB DET NOUN PRON VERB NOUN DET PUNCT ADV VERB ADP NOUN ADJ PUNCT	sna
Dambudziko riri kusangana na Va Mangwiro , i dambudziko riri kusanganawo na Amai Pauline Mpotaringwa veku Glen View , avo vanoshandisa wheelchair pamwe nekupfeka ma pampers .	NOUN AUX VERB ADP NOUN PROPN PUNCT AUX NOUN AUX VERB ADP NOUN PROPN PROPN ADP PROPN PROPN PUNCT PRON VERB NOUN CCONJ VERB ADP NOUN PUNCT	sna
Studio7 haina kukwanisa kunzwa ku bazi re zvekugara zvakanaka kwe kvanhu kuti seyi vakaremara ava vasiri kuwana rubatsiro kubva ku homwe ye mari inoita mazana matanhatu e mamiriyoni e madhora , iyo yakaparurwa ne hurumende ichinzi ichashandiswa kwe mwedzi mitatu , mukubatsira vanhu vanoshaya .	PROPN ADV VERB VERB ADP NOUN ADP NOUN ADJ ADP NOUN DET ADV NOUN PRON ADV VERB NOUN ADP ADP NOUN ADP NOUN VERB NUM NUM ADP NUM ADP NOUN PUNCT PRON VERB ADP NOUN VERB VERB ADP NOUN NUM PUNCT VERB NOUN VERB PUNCT	sna
Va Ceedy Chitsiwah , avo vanoshandisa wheelchair , vanoti vakaremara vakawanda vari kushaya pekubata nekuda kwe maomero akaita zvinhu mu nguva ino .	NOUN PROPN PROPN PUNCT PRON VERB NOUN PUNCT VERB NOUN ADJ AUX VERB NOUN SCONJ ADP NOUN VERB NOUN ADP NOUN DET PUNCT	sna
Ku munhu akaremara mabhindauko mashoma , kunyanya usina mari yekuti utange kana kusimudzira projekiti .	ADP NOUN ADJ NOUN ADJ PUNCT ADV ADP NOUN ADP VERB CCONJ VERB NOUN PUNCT	sna
Ndanga ndichitofunga kuti masecretarial services ndiwo angaite se munhu asingakwanise kushandisa nhengo dzake dzese dze muviri .	AUX VERB DET NOUN NOUN AUX VERB ADV NOUN ADV VERB NOUN PRON ADJ ADP NOUN PUNCT	sna
Asi makambani acho ne zvikoro zvakavhara , vanodaro Va Chitsiwah .	SCONJ NOUN PRON ADP NOUN VERB PUNCT VERB NOUN PROPN PUNCT	sna
Imwe nhengo ye Tracy Nyakupinda Albino Foundation , Va Shingirai Nyakupinda , vanoti kunyange hazvo zvakaoma kudai , vakaremara vakawanda vari kuitawo mabhindauko avanokwanisa , kuitira kuti vararame .	PRON NOUN ADP PROPN PROPN PROPN NOUN PUNCT NOUN PROPN PROPN PUNCT VERB ADV CCONJ ADJ ADV PUNCT NOUN ADJ AUX VERB NOUN ADJ PUNCT ADV DET VERB PUNCT	sna
Kushayikwa kwe transport kuri kukanganisa vakaremara vakawanda , asi vamwe vari kungoenda kunohodha zvinhu zvavo pamwechete ne vamwe .	VERB ADP NOUN AUX VERB NOUN ADJ PUNCT SCONJ PRON AUX VERB VERB NOUN PRON ADV ADP PRON PUNCT	sna
Mapurisa haasi kuzonyanya kuvashungurudza .	NOUN ADV ADJ VERB PUNCT	sna
Kudzamara mari ye rubatsiro iyi vaibata mu maoko avo , vakaremara vakaita sa Va Nyakupinda , Va Mangwiro ne vamwe vavo , vacharamba vachitambura vasina rubatsiro rwavari kuwana pa nguva iyo hurumende iri kuzvirova dundundu ichiti iri kubatsira vose vanotambura mu nguva ino ye Lockdown .	SCONJ NOUN ADP NOUN DET VERB ADP NOUN PRON PUNCT NOUN DET ADV NOUN PROPN PUNCT NOUN PROPN CCONJ PRON DET PUNCT VERB VERB ADP NOUN AUX VERB ADP NOUN DET NOUN AUX VERB NOUN VERB AUX VERB ADJ VERB ADP NOUN DET ADP NOUN PUNCT	sna
Nemusi we Svondo Zimbabwe yakabatana ne dzimwe nyika pasi rose kucherechedza zuva rekutorwa kwe nhau zvakasungunuka kana kuti World Press Freedom Day .	NOUN ADP NOUN PROPN VERB ADP PRON NOUN NOUN ADJ VERB NOUN VERB ADP NOUN ADJ CCONJ DET PROPN NOUN NOUN NOUN PUNCT	sna
Zuva iri rakatanga kucherechedzwa gore roga roga musi wa 3 Chivabvu kutanga muna 1993 ne United Nations kuburikidza ne bazi re UNESCO .	NOUN DET VERB VERB NOUN ADJ ADJ NOUN ADP NUM PROPN VERB ADP NUM ADP PROPN PROPN ADV ADP NOUN ADP PROPN PUNCT	sna
Asi gore rino munyori mukuru we United Nations Va Antonio Guterres vanoti basa re vatori ve nhau rakanyanya kukosha pasi rino sezvo nyika dzakawanda dziri kurwisa chirwere che Coronavirus . Va Gutterres vanoti kurwisa chirwere ichi kunoda mashoko e chokwadi sezvo vamwe vave kuparidza manyepo .	SCONJ NOUN DET NOUN ADJ ADP PROPN PROPN NOUN PROPN PROPN VERB NOUN ADP NOUN ADP NOUN ADJ ADJ NOUN ADJ ADV NOUN ADJ AUX VERB NOUN ADP PROPN PUNCT NOUN PROPN VERB VERB NOUN DET VERB NOUN ADP NOUN ADV PRON AUX VERB NOUN PUNCT	sna
Dingindira re gore rino rakanangana nekuti vatori ve nhau vashande vasingatye kana kurerekera divi .	NOUN ADP NOUN DET VERB ADP NOUN ADP NOUN VERB VERB CCONJ VERB NOUN PUNCT	sna
Mukuru we sangano re UNESCO Muzvare Audrey Azoulay vanoti zvakakosha kuti basa re nhau riitwe pasina kupindira kwevezve matongerwo e nyika kana vezve mabhizimisi sezvo kuchikanganisa basa iri .	NOUN ADP NOUN ADP PROPN NOUN PROPN PROPN VERB ADJ DET NOUN ADP NOUN VERB ADV VERB ADP NOUN ADP NOUN CCONJ ADP NOUN ADV VERB NOUN DET PUNCT	sna
Mukuru we Media Institute of Southern Africa Zimbabwe Va Tabani Moyo vanoti sangano ravo rinofara ne dingindira iri vachiti rinotaura zvinhu zvavanogara vachitaura kuti hurumende inofanirwa kukoshesa .	NOUN ADP NOUN NOUN ADP NOUN PROPN PROPN NOUN PROPN PROPN VERB NOUN PRON VERB ADP NOUN DET VERB VERB NOUN ADV VERB DET NOUN VERB VERB PUNCT	sna
Asi vanoti maonero avo ndeekuti hurumende ya Va Emmerson Mnangagwa haisi kuzadzikisa zvainotaura pa kusimudzira mabasa e nhau kana kufambiswa kwe mashoko pasina kumbunyikidzwa .	SCONJ VERB VERB PRON VERB NOUN ADP NOUN PROPN PROPN ADV VERB VERB ADP VERB NOUN ADP NOUN CCONJ VERB ADP NOUN ADP VERB PUNCT	sna
Chipangamazano mu sangano re Human Rights Watch uye vari gweta rinorwira kodzero dze vanhu Va Dewa Mavhinga vanoti makore makumi mana nyika yawana kuzvitonga , hurumende ichine basa guru mukusimudzira kodzero dzine chekuita ne kutapwa kwe nhau kana kufambiswa kwe mashoko .	NOUN ADP NOUN ADP PROPN PROPN PROPN CCONJ AUX NOUN VERB NOUN ADP NOUN NOUN PROPN PROPN VERB NOUN NUM NUM NOUN VERB VERB PUNCT NOUN AUX NOUN ADJ VERB NOUN AUX VERB ADP VERB ADP NOUN CCONJ VERB ADP NOUN PUNCT	sna
