text	target	condition
Uretse kwambara bikini mu marushanwa y " ubwiza hari ibihugu akorerwa mu tubari , utubyiniro , imikino ya boxing n " ahandi ; aho abahize abandi bahabwa ibikombe , amafaranga cyangwa se amasezerano yo gukora ibijyanye no kumurika imideli .	CCONJ VERB PROPN ADP NOUN PRON PUNCT NOUN VERB NOUN VERB ADP VERB PUNCT NOUN PUNCT NOUN PRON NOUN CCONJ PUNCT PRON PUNCT PRON VERB PRON VERB NOUN PUNCT NOUN CCONJ CCONJ NOUN PRON VERB VERB CCONJ VERB NOUN PUNCT	kin
N " ubwo ayo marushanwa yabaga ari menshi , ntabwo yahabwaga agaciro .	CCONJ PUNCT SCONJ PRON NOUN VERB VERB ADJ PUNCT SCONJ VERB NOUN PUNCT	kin
Ényí Angélique Kijo lɛ́ yí ajɔ ɔ́ ɖò azǎn 26ɔ́ aluunsùn ɔ́ tɔn gbadanu ɔ́ " hǔn è ná bló atinkpavi ɛnɛgɔ́ ɔ́ níí .	SCONJ PROPN PROPN DET VERB NOUN DET ADP NOUN NUM PROPN DET ADJ NOUN DET PUNCT NOUN PRON VERB VERB NOUN ADV DET ADP PUNCT	fon
Amɔ̌ có nǔ ná nyí mɔ̌ ɔ́ " é ná tó xò nyà nǔbaɖabaɖa Awɔnlin nù ɔ́ hwɛ̌ " é wɛ́ ɖù baba nú " Afrofusion Burna Boy " " ɖò akpáxwé han è gbɛ ɔ́ bǐ tuun ɔ́ tɔn xwè élɔ́ .	CCONJ ADP NOUN VERB AUX ADV DET PUNCT PRON VERB ADV VERB AUX NOUN NOUN ADP DET ADV PUNCT PRON VERB VERB PROPN ADP PUNCT PROPN PROPN PROPN PUNCT PUNCT VERB NOUN ADV PRON NOUN DET ADJ ADV DET ADJ NOUN ADJ PUNCT	fon
Gbɔn gbetakɛ́n è xixa tɔn nyí EP21 - 2 ɔ́ gblamɛ ɔ́ " sɛ́n dódó gbásá ɔ́ ɖè nyǐ dotóoxwé tɔnjɛji ée ná gbéjé lanmɛ kpɔ́n nú yemɛ è xwè agbahwlɛnhwlɛn tògán sísɔ́ tɔn ɖò azǎn 11ɔ́ lidósùn xwè 2021ɔ́ tɔn gbè lɛ́ɛ é .	NOUN NOUN PRON NOUN ADJ AUX PROPN PUNCT NUM DET ADP DET PUNCT NOUN ADV NOUN DET VERB AUX NOUN ADJ PRON VERB VERB NOUN ADV ADP PRON PRON NOUN NOUN NOUN NOUN ADJ ADP NOUN NUM PROPN NOUN NUM ADJ NOUN DET PART PUNCT	fon
Dotóo gán ɖokpó kpódó mɛ ée xò kpó ɖó níí ɔ́ kpán nú akpáxwé ayizɛn ée kan mɛ gbéjé gbéjé kpɔ́n sín nǔwíwá ɔ́ é .	NOUN NOUN NUM CCONJ NOUN PRON VERB VERB VERB PART DET CCONJ ADP NOUN NOUN PRON ADV PRON VERB NOUN ADJ ADP NOUN DET PART PUNCT	fon
Ɖò sɛ́nkwín atɔngɔ́ ɔ́ gbetakɛ́n nɛ́ tɔn mɛ̀ ɔ́ " azɔ̌ è nyí yetɔn ɔ́ wɛ́ nyí ye ná sɔ́ gbɛta dotóo lɛ́ɛ tɔn ɖò tè : dotóo tɔnjɛji Lucien Dòsú - Yovo " dotóoxwé Louis Pasteur ée ɖò Xɔgbonu é tɔn .	ADP NOUN NUM DET VERB ADJ ADJ ADP DET PUNCT NOUN PRON AUX ADJ DET VERB AUX PRON VERB VERB NOUN ADV DET ADJ ADP VERB PUNCT ADV ADJ PROPN PROPN PUNCT PROPN PUNCT NOUN PROPN PROPN PRON VERB PROPN PART ADJ PUNCT	fon
È bó lɛ́ xà : Mɛ ka nyí Sakina " nyɔ̌nu akowunka Woria tɔn ɔ́ ? Aklunɔzángbla we gudo ɔ́ " éyɛ́ è jɛ nyǐ " Akowunka Woria tɔn " ɔ́ " wá Kutɔnu bó wá kpé tògán ɔ́ .	PRON ADP ADV VERB PUNCT NOUN ADV AUX PROPN PUNCT NOUN NOUN PROPN ADJ DET PUNCT NOUN NUM ADV DET PUNCT PRON PRON VERB AUX PUNCT NOUN PROPN ADJ PUNCT DET PUNCT VERB PROPN ADP VERB VERB NOUN DET PUNCT	fon
Hɛ̌n(NUM)ɔ tɔn kpɛɖé kpódó gǎn - hɔn - yì - tɔ́ ée nɔ́ kpénúkún dó nunɔmɛ gbɛtɔ́ lɛ́ɛ tɔn kpódó akwɛ́ nyinya kpán wú ɔ́ xwédó è bó kplɛ́ yì tògán ɔ́ gɔ́n bɛ́ dógbè níí ɖó tò ɔ́ bǐ tamɛ .	NOUN ADJ ADV CCONJ NOUN PUNCT VERB PUNCT VERB PUNCT ADJ PRON AUX VERB ADP NOUN NOUN DET ADJ CCONJ NOUN AUX CCONJ ADP DET VERB PRON CCONJ VERB VERB NOUN DET VERB CCONJ ADV ADP VERB NOUN DET ADJ PROPN PUNCT	fon
Patrice TALƆN yí nawe ví ɔ́ sín jǒnɔ ɖò tògán ɔ́ gbásá ɖò fúfónu kplé gǎn - hɔn - yì - tɔ́ lɛ́ɛ tɔn ɖò azǎn azǎngagbè avùvɔ̀ xwè 2020ɔ́ tɔn .	PROPN PROPN VERB VERB ADP DET ADV NOUN ADP NOUN DET NOUN ADP NOUN VERB NOUN PUNCT VERB PUNCT VERB PUNCT ADJ DET ADJ VERB NOUN NOUN PROPN NOUN NUM ADJ PUNCT	fon
Tògán gbɔn yɛkan ɔ́ mɛ̀ bó dà tòví lɛ́ɛ bǐ ɖɔ ye ní jɛhun dó mɛhwɛngán zɔ́ ɔ́ wú lě ye kpéwú gbɔn lé hwe tɔn nù .	NOUN ADV NOUN DET ADP ADP VERB NOUN DET ADJ ADV PRON ADP VERB ADP NOUN ADV DET ADP ADJ PRON VERB ADP ADV NOUN ADJ ADP PUNCT	fon
Lě è ná wlibo nú mɔzo ná xwé ɔ́ gbɔn ɔ́ " mɛ ée gbá é wɛ́ ɖɔ " bɔ è sɔ́ dó alɔ mɛ nú gbɛta ée tuun azɔ̌ nɛ́ ɔ́ céɖé céɖé é bɔ lě é ná bló gbɔn bɔ mɔzo ɔ́ ná sú déjí ɔ́ wɛ́ nɔ́ mya núkún níí .	ADJ PRON VERB VERB ADP NOUN VERB NOUN DET ADP DET PUNCT NOUN PRON VERB PRON VERB ADJ PUNCT CCONJ PRON VERB VERB NOUN PRON ADP NOUN PRON VERB NOUN ADJ DET ADJ ADJ ADP CCONJ ADJ PRON VERB VERB ADP CCONJ NOUN DET VERB VERB VERB DET VERB VERB ADV NOUN ADP PUNCT	fon
Mí tɛ́ tó yɛ è Jérome Hungbɔ wlí é wú .	PRON VERB VERB DET PRON PROPN PROPN VERB PRON ADP PUNCT	fon
 Acɛkpìkpà ɔ́ ɖò nukɔntɔ́ sinsɛn gun lɛ́ɛ tɔn kpódó tòví lɛ́ɛ bǐ kpán dá wɛ ɖɔ ye ní wànǔ xwédó nǔzɔnmɛ nɛ́ lɛ́ɛ bǐ bónú è na síxú nyí lè nú tò ɔ́ bǐ  " gǎn - hɔn - yì - tɔ́ Sacca Lafia wɛ́ lá wɛn nɛ́ .	PUNCT NOUN DET VERB NOUN ADV NOUN DET ADJ CCONJ NOUN DET ADJ CCONJ VERB VERB ADP PRON ADP VERB NOUN NOUN ADJ DET ADJ SCONJ PRON VERB VERB AUX ADP ADP NOUN DET ADJ PUNCT PUNCT NOUN PUNCT VERB PUNCT VERB PUNCT ADJ PROPN PROPN VERB VERB NOUN ADJ PUNCT	fon
È sú sinsɛnnuwatɛn lɛ́ɛ sín azǎn 22ɔ́ xwèjísùn ɔ́ tɔn ɖokpóo .	PRON VERB NOUN DET ADV NOUN NUM PROPN DET ADJ ADV PUNCT	fon
Sùn we wɛ è ná ɖayǐ " din ɔ́ è dlɛn kàn ná káká yì azǎn 19ɔ́ lidósùn ɔ́ tɔn gbè .	NOUN NUM VERB PRON VERB ADV PUNCT ADV DET PRON VERB NOUN VERB ADV VERB NOUN NUM PROPN DET ADJ NOUN PUNCT	fon
Klisanwun lɛ́ɛ xò Pasikwa sín hwenu ɔ́ zlɛ má lya yɛhwenɔ xwédó yetɔn lɛ́ɛ kpódó goxɔ yetɔn lɛ́ɛ kpán .	NOUN DET ADV PROPN ADP NOUN DET VERB VERB VERB VERB NOUN ADJ DET CCONJ NOUN ADJ DET CCONJ PUNCT	fon
Kàn è è lɛ́ gbɛ dó amisa xwé lɛ́ɛ " sɛkpetɛn lɛ́ɛ " goxɔ lɛ́ɛ kpódó hùnkpámɛ lɛ́ɛ kpán súsú nù ɔ́ " ná xò flógò malɛnu wú alɔkpa vò .	NOUN PRON PRON ADV VERB ADP NOUN NOUN DET PUNCT NOUN DET PUNCT NOUN DET CCONJ NOUN DET CCONJ NOUN ADP DET PUNCT VERB VERB VERB PROPN ADP NOUN ADP PUNCT	fon
Malɛnu lɛ́ɛ ná bɛ́ nublabla aklunɔzangbla ée jǎwe ɔ́ mɛ̀ .	NOUN DET VERB VERB NOUN NOUN PRON VERB DET ADP PUNCT	fon
Yehwe xà dó kpɔ́ ée gblamɛ agùn ví lɛ́ɛ nɔ́ kplé ɖè ɔ̀ ɖě ná tîin ǎ .	NOUN ADV VERB VERB PRON ADP NOUN ADV DET VERB VERB ADP DET ADJ VERB VERB PART PUNCT	fon
Ɖò azǎn 17ɔ́ lidósùn ɔ́ tɔn gbè ɔ́ " Benɛ xlé ɖɔ mɛ 35 wɛ́ bɛ́ azɔnkwín kolonâ ɔ́ .	ADP NOUN NUM PROPN DET ADJ NOUN DET PUNCT PROPN NOUN ADV NOUN NUM VERB VERB NOUN PROPN DET PUNCT	fon
Azɔn gbɔ nú mɛ 18 .	NOUN ADP ADP NOUN NUM PUNCT	fon
È ɖò mɛ 16 tɔ́jú wɛ .	PRON VERB NOUN NUM ADJ ADP PUNCT	fon
Mɛ ɖokpó gée jɛn ká kú .	NOUN NUM PRON VERB ADV VERB PUNCT	fon
Ɖò linlin ɖokpó nɛ́ mɛ̀ ɔ́ " wěmá yí bó ná byɔ́ Benɛ tò mɛ̀ ɔ́ " ɖó jlɛ̌ .	ADP NOUN NUM ADJ ADP DET PUNCT NOUN VERB ADP VERB VERB PROPN NOUN ADP DET PUNCT VERB VERB PUNCT	fon
Mɛ ɖěbǔ ée ná dó jɔhɔnmɛ hún bó ná wá Benɛ ɔ́ " è ná zín jí tɔn bɛ́ ná nɔ avatɛn nú azǎn 14 hwɛ̌ .	NOUN ADJ PRON VERB VERB VERB ADP ADP VERB VERB PROPN DET PUNCT PRON VERB VERB ADP ADJ CCONJ VERB VERB NOUN ADP NOUN NUM ADV PUNCT	fon
Énɛ́ wú ɔ́ " è yí xɔ̀ ɖélɛ́ɛ ɖò gbɛɖutɛn ɖélɛ́ɛ .	PRON ADP DET PUNCT PRON VERB NOUN ADJ ADP NOUN DET PUNCT	fon
Acɛkpìkpà ɔ́ ná sú akwɛ́ Benɛ ví ée è bɛ́ yì avatɛn lɛ́ɛ kɛɖɛ tɔn .	NOUN DET VERB VERB NOUN PROPN ADV PRON PRON VERB VERB NOUN DET NOUN ADJ PUNCT	fon
Kponɔ lɛ́ɛ ná jɛhun ayǐ nɛ́ɛ jí bɔ ayijayǐ ná tîin .	NOUN DET VERB VERB NOUN ADJ ADP CCONJ NOUN VERB VERB PUNCT	fon
Gǎn - hɔn - yì - tɔ́ lɛ́ɛ yì hɔn bó ɖè gbetakɛ́n tɔ́n ɖɔ mɛɖé kún sɔ́ ná zɛhwɛ yì azɔgbénu ɖě ó " nǔwíwá ɖé " agɔ̌ ɖúɖú gannyǐ gannyǐ ée ná kunkpla lɔ̌n yì jǐ lɔ̌n fɔn kàn " hwɛndo nú wíwá " sinsɛn nú wíwá " tòxò ɖíɖɔ́ ɖé kún ná tîin ó "	NOUN PUNCT VERB PUNCT VERB PUNCT ADJ DET VERB VERB ADP VERB NOUN ADJ ADJ PRON ADP VERB VERB VERB VERB NOUN DET ADP PUNCT NOUN DET PUNCT NOUN VERB ADV ADV PRON VERB NOUN ADV VERB ADV ADV VERB NOUN PUNCT NOUN ADP NOUN PUNCT NOUN ADP NOUN PUNCT NOUN ADV DET ADP VERB VERB ADP PUNCT	fon
mɔ̌ ɖokpó ɔ́ hwɛ zizɛ mímɛ́ yì Maka ɖě sɔ́ ná tîin ǎ .	NOUN NUM DET VERB VERB PRON VERB PROPN ADJ VERB VERB VERB PART PUNCT	fon
Galiou Soglo " gǎn - hɔn - yì - tɔ́ xóxó ée ɖò nǔ sɔ́ wɛ bó ná yì sɔ́mì sɔ́mì ɔ́ tògán sísɔ́ tɔn ée ɖò azǎn 11ɔ́ lidósùn xwè 2021ɔ́ tɔn gbè ɔ́ " awě ɖé xò é ɖò axɔ́súzángbè azǎn 5ɔ́ zofínkplɔ́sùn ɔ́ tɔn gbè bɔ̀ è gblé wǔ í kpódó tú kpán .	PROPN PROPN PUNCT NOUN PUNCT VERB PUNCT VERB PUNCT ADJ ADJ PRON VERB NOUN AUX VERB ADP VERB VERB NOUN NOUN DET NOUN NOUN ADJ PRON VERB NOUN NUM PROPN NOUN NUM ADJ NOUN DET PUNCT NOUN ADV VERB PRON VERB NOUN NOUN NUM PROPN DET ADJ NOUN CCONJ PRON VERB NOUN ADP CCONJ ADP CCONJ PUNCT	fon
É yí kpɛ́n bɔ è kplɛ́ yì CNHU " Hubert Maga tɔn ɖò Kutɔnu . Ví sunnu tògán xóxó Nicéphore Soglo tɔn ɔ́ xwè glè tɔn mɛ̀ ɖò tokpɔnlaví kpanrou tɔn ée ɖò tokpɔnla Agbomɛ Kánɖòfí é mɛ̀ " bɔ adǎn mɔ̌wun dó gbó é axɔ́súzángbè ée wá yì é gbadanu .	PRON VERB VERB CCONJ PRON VERB VERB PROPN PUNCT PROPN PROPN ADJ ADP PROPN PUNCT PRON NOUN NOUN ADJ PROPN PROPN ADJ DET NOUN NOUN ADJ ADP ADP NOUN ADV ADJ PRON VERB NOUN NOUN PROPN PART ADP PUNCT CCONJ NOUN ADJ ADP ADV PRON NOUN PRON VERB VERB PART NOUN PUNCT	fon
É ko bló azǎn atɔn din bɔ nǔ nɛ́ jɛ " lě nǔ lɛ́ɛ ká nyí gbɔn ɔ́ " mɛɖé ká ko tuun ǎ " mɛ bǐ wɛ́ flú ɖémɛ .	PRON ADV VERB NOUN NUM ADV CCONJ NOUN ADJ VERB PUNCT ADJ NOUN DET ADV AUX ADP DET PUNCT NOUN ADV ADV VERB PART PUNCT PRON ADJ VERB NOUN ADV PUNCT	fon
Tòxò ɖɔ́ gbɛta lɛ́ɛ kplé bó ɖè ɖɔ nú è sè tɔ́n bó ɖɔ nǔ mɔ̌wun kún ɖó ná jɛ ó ; ye wɛ́ nyí " Démocrates lɛ́ɛ́ " FCBE " PRD " Front pour la restauration de la démocratie . "	NOUN ADV NOUN DET VERB ADP VERB VERB ADP PRON VERB ADJ ADP VERB NOUN ADJ ADP ADV VERB VERB ADP PUNCT PRON VERB AUX PUNCT PROPN DET PUNCT PROPN PUNCT PROPN PUNCT NOUN NUM PART PROPN ADV PART NUM PUNCT PUNCT	fon
Ye ɖò acɛkpìkpà ɔ́ dá wɛ ɖɔ ní bló gbɔn ɖě bó tá myɔ dó xó nɛ́ jí " ní bó ká lɛ́ xò kàn nú ayi - ná - jayǐ nú tòví lɛ́ɛ .	PRON VERB NOUN DET VERB VERB PRON ADP VERB ADP ADJ ADP VERB ADV VERB NOUN ADJ ADP PUNCT ADP ADP ADV DET VERB NOUN ADP NOUN PUNCT VERB PUNCT VERB ADP NOUN DET PUNCT	fon
Nukɔntɔ́ tòxó ɖɔ́ gbɛta tɔn lɛ́ɛ gege hwlɛndo bó yì bà gǎn - hɔn - yì - tɔ́ xóxó ɔ́ kpɔ́n ɖò dotóoxwé .	NOUN NOUN VERB NOUN ADJ DET ADV VERB ADP VERB ADP NOUN PUNCT VERB PUNCT VERB PUNCT ADJ NOUN DET VERB ADP NOUN PUNCT	fon
Walɔ yaɖé yaɖé nɛ́ ɔ́ byɔ́ tutomɛ è acɛkpìkpà ɔ́ sɔ́ ɖayǐ bó ná liza xá azɔnkwín é mɛ̀ .	NOUN ADJ ADJ ADJ DET VERB NOUN PRON NOUN DET VERB ADV ADP VERB VERB ADV NOUN ADP ADP PUNCT	fon
 Di lě mí ko tuun gbɔn é ɔ́  sín hwenu azɔnkwín nɛ́ ko wá é ɔ́ " acɛkpìkpà ɔ́ sɔ́ walɔ ɖé dó tè bó ná nɔ́ cyɔn alɔ mɛ ée gosin tò gudo lɛ́ɛ jí ná .	PUNCT ADV ADJ PRON ADV VERB ADP PART DET PUNCT ADV NOUN NOUN ADJ ADV VERB PART DET PUNCT NOUN DET VERB NOUN ADJ ADP VERB ADP VERB VERB VERB NOUN NOUN PRON VERB NOUN ADV DET ADP ADP PUNCT	fon
Mì nɔ́ bɛ́ yě dó avatɛn nú azǎn woɛnɛ " bɔ azǎn nɛ́ lɛ́ɛ gblamɛ ɔ́ " mì nɔ́ gbéjé azɔnkwín ɔ́ ɖò lanmɛ nú yemɛ ée gosin tò mɛ̀ hwɛ̌ có bó nɔ́ jó yě dó " Benjamin Hùnkpátín wɛ́ flín nǔ nɛ́ .	PRON VERB VERB PRON ADP NOUN ADP NOUN NUM PUNCT CCONJ NOUN ADJ DET ADP DET PUNCT PRON VERB VERB NOUN DET VERB NOUN ADP PRON PRON VERB NOUN ADP ADV ADP CCONJ VERB VERB PRON ADP PUNCT PROPN PROPN VERB VERB NOUN ADJ PUNCT	fon
FCBE wá tɛn ɔ́ mɛ̀ " è síxú gɔn má wɔ́ ǎ .	PROPN VERB NOUN DET ADP PUNCT PRON VERB NOUN VERB VERB PART PUNCT	fon
Tòxó ɖɔ́ gbɛta nɛ́ ée má ɖò gbè ɖokpó ɔ́ dó xá acɛkpìkpà ɔ́ wɛ ǎ ɔ́ yì sɔ́mì sɔ́mì ɖɛmɛnu lɛ́ɛ tɔn ée wá yì é ɔ́ ǎ .	NOUN ADV NOUN ADJ PRON VERB VERB NOUN NUM DET VERB ADV NOUN DET SCONJ PART DET VERB NOUN NOUN NOUN DET ADJ PRON VERB VERB PART DET PART PUNCT	fon
Nukɔntɔ́ tɔn lɛ́ɛ wá bó ná nyǐkɔ́ yetɔn wěmá mɛ̀ " Paul Hunkpɛ " wěgbójínɔtɔ́ tòxó ɖɔ́ gbɛta ɔ́ tɔn wɛ́ nyí ahwan nukɔn sya ɔ́ .	NOUN ADJ DET VERB ADP VERB NOUN ADJ NOUN ADP PUNCT PROPN PROPN PUNCT NOUN NOUN VERB NOUN DET ADJ VERB AUX NOUN ADJ ADV DET PUNCT	fon
Ɖibla nyí gàn xixo ɖokpó ɔ́ mɛ̀ xá FCBE sín mɛ lɛ́ɛ ɔ́ " tòxó ɖɔ́ gbɛta acɛkpìkpà ɔ́ tɔn " UP " ée nyí kplékplé ɖɛmɛnu 46 tɔn ɔ́ " lɔ́ɔ wá CENA bó dó nyǐkɔ́ yetɔn wěmá mɛ̀ .	NOUN AUX NOUN NOUN NUM DET ADP ADV PROPN ADP NOUN DET DET PUNCT NOUN VERB NOUN NOUN DET ADJ PUNCT PROPN PUNCT PRON AUX NOUN NOUN NUM ADJ DET PUNCT ADV VERB PROPN ADP VERB NOUN ADJ NOUN ADP PUNCT	fon
Modeste Kérékou " gǎn - hɔn - yì - tɔ́ ée nɔ́ kpénúkún dó azɔxwé klewun klewun lɛ́ɛ kpódó kàn vlɔn nú azɔ̌ bíbá kpán wú ɔ́ " hùn nǔ sín azɔxwé kanɖó gbásá ée ná nɔ́ kpénúkún azɔ̌ xó wú é ɔ́ nù .	PROPN PROPN PUNCT NOUN PUNCT VERB PUNCT VERB PUNCT ADJ PRON AUX VERB ADP NOUN ADV ADV DET CCONJ NOUN VERB ADP NOUN VERB CCONJ ADP DET PUNCT NOUN NOUN ADP NOUN NUM NOUN PRON VERB VERB VERB NOUN ADJ ADP PART DET ADP PUNCT	fon
Azɔbatɔ́ lɛ́ɛ hɛn din ɔ́ " " ye ná kpé azɔxwé gege ɖò nɔtɛn ɖokpó ɔ́ " bó hɛn ɔ́ " ye ná sɔ́ nǔtuuntuun yetɔn kpódó nyɔ̌wa yetɔn kpán dó ajò " lóbónú è ɖó hudo yetɔn ɔ́ " è ná yí yě " " nǔ è é ɖɔ è nɛ́ .	NOUN DET VERB ADV DET PUNCT PUNCT PRON VERB VERB NOUN ADV ADP NOUN NUM DET PUNCT ADP VERB DET PUNCT PRON VERB VERB NOUN ADJ CCONJ NOUN ADJ CCONJ ADP NOUN PUNCT NOUN PRON VERB NOUN ADJ DET PUNCT PRON VERB VERB PRON PUNCT PUNCT NOUN PRON PRON VERB PRON ADJ PUNCT	fon
Azɔxwé 42 wɛ è sɔ́ ɖótè bó ná yí mɛ ée ɖò azɔ̌ bá wɛ lɛ́ɛ lě è ɖó hudo nyɔ̌wa yetɔn tɔn gbɔn é .	NOUN NUM VERB PRON VERB ADV ADP VERB VERB PRON PRON VERB NOUN CCONJ VERB DET ADV PRON VERB NOUN NOUN ADJ ADJ ADP PART PUNCT	fon
Hwenu è hùn azɔxwé kanɖó gbásá nɛ́ ɔ́ toolo ɔ́ " ye sukpɔ́ bó wá bó hɛn azɔ̌ bá wémá yetɔn alɔ nù lóbó nú è ná cyan xó xá yě bó ná yí yě lě jɛxa gbɔn lé .	NOUN PRON VERB NOUN NUM NOUN ADJ DET NOUN DET PUNCT PRON ADV ADP VERB ADP VERB NOUN ADP NOUN ADJ NOUN ADP CCONJ ADP PRON VERB VERB ADJ ADV PRON ADP VERB VERB PRON ADV VERB ADP ADV PUNCT	fon
Mɛ ée ɖò mɛ bá ná yí do azɔmɛ wɛ lɛ́ɛ ɔ́ " tɛn 1704 wɛ́ ɖò ye sí .	NOUN PRON VERB NOUN ADP VERB VERB ADP NOUN ADP DET DET PUNCT NOUN PROPN VERB ADP PRON ADP PUNCT	fon
Mɛ ée ɖò azɔ̌ bá wɛ bɔ è má yí yě din ǎ lɛ́ɛ ɔ́ " azɔxwé lɛ́ɛ ná wá ɖó hudo yetɔn lóbó ná yí yě .	NOUN PRON VERB NOUN ADP VERB CCONJ PRON VERB VERB PRON ADV PART DET DET PUNCT NOUN DET VERB VERB ADP NOUN ADJ CCONJ VERB VERB PRON PUNCT	fon
Ɖi lě è lá gbɔn ɖò kplé gǎn - hɔn - yì - tɔ́ lɛ́ɛ tɔn ɔ́ ɖò azǎn 24ɔ́ xwèjísùn ɔ́ tɔn ɔ́ " yɛ̌n dó bá gán ɖò kovidi - 19 sí ɔ́ ná bɛ́ ɖò azǎn 29ɔ́ xwèjísùn xwè 2021ɔ́ tɔn gbè ɖò Kutɔnu .	ADP ADJ PRON VERB ADP ADP VERB NOUN PUNCT VERB PUNCT VERB PUNCT ADJ DET ADJ DET ADP NOUN NUM PROPN DET ADJ DET PUNCT NOUN VERB VERB NOUN ADP NOUN PUNCT NUM VERB DET VERB VERB VERB NOUN NUM PROPN NOUN NUM ADJ NOUN ADP PROPN PUNCT	fon
Mɛ nukɔntɔn è è ná dó yɛ̌n nɛ́ ná ɔ́ wɛ́ nyí gǎn - hɔn - yì - tɔ́ ée nɔ́ kpénúkún dó lanmɛ ná nɔ̀ ganjí wú é " Benjamin Hùnkpátín .	NOUN NOUN PRON PRON VERB VERB VERB ADJ VERB DET VERB AUX NOUN PUNCT VERB PUNCT VERB PUNCT ADJ PRON AUX VERB ADP NOUN VERB VERB ADV ADP PART PUNCT PROPN PROPN PUNCT	fon
Benɛ yí yɛ̌n 144000 " AstraZenéca " tɔn kpódó yɛ̌n 203000 " CoronaVac " tɔn kpán .	PROPN VERB DET NUM PUNCT PROPN PUNCT ADJ CCONJ DET NUM PUNCT PROPN PUNCT ADJ CCONJ PUNCT	fon
Mɛ nukɔntɔn ée ná dó yɛ̌n nɛ́ lɛ́ɛ wɛ́ nyí dotóo lɛ́ɛ " mɛ ée ko ɖò azɔn ɖevo lɛ́ɛ jɛ wɛ lɛ́ɛ é ( aɖɔ̌ víví zɔn " hùn yì jǐ zɔn " kpɛ́n gbɔ xíí " hùn jí zɔn " xúɖu xúɖu ) kpódó mɛxo ée ko ɖó xwè 60 jɛji lɛ́ɛ é kpán .	NOUN ADJ PRON VERB VERB ADV ADJ DET VERB AUX ADV DET PUNCT NOUN PRON ADV VERB NOUN ADJ DET VERB VERB DET PART PUNCT NOUN VERB ADV PUNCT NOUN VERB ADP ADV PUNCT ADV ADP NOUN PUNCT NOUN ADP ADV PUNCT NOUN ADV PUNCT CCONJ NOUN PRON ADV VERB NOUN NUM ADV DET PART CCONJ PUNCT	fon
Xó è kàn Kovidi - 19 è bǐ : yɛ̌n nukɔntɔn dídó nɛ́ gudo ɔ́ " Benjamin Hùnkpátín ná lɛ́ɛ dó wegɔ́ ɔ́ ɖò azǎn 31ɔ́ nǔxwásùn ɔ́ tɔn gbè bó ná nyí Kpɔndewu ɖò tutomɛ ée ɖò za li xá azɔnkwín Kovidi - 19 wɛ́ é gɔ́n .	NOUN PRON VERB NOUN PUNCT NUM PRON ADJ PUNCT NOUN NOUN ADV ADJ ADV DET PUNCT PROPN PROPN VERB DET VERB ADJ DET AUX NOUN NUM PROPN DET ADJ NOUN ADP VERB AUX NOUN VERB NOUN PRON VERB VERB ADV ADV NOUN PROPN PUNCT NUM VERB PRON VERB PUNCT	fon
Gǎn - hɔn - yì - tɔ́ ée nɔ́ kpénúkún dó lanmɛ ná nɔ̀ ganjí wú é ɔ́ lɛ́ ɖò mɛ ée yɛ̌n nɛ́ ɔ́ kàn é lɛ́ɛ dá wɛ nú ye ná síxú yí dó xɛsi mɛvo .	NOUN PUNCT VERB PUNCT VERB PUNCT ADJ PRON AUX VERB ADP NOUN VERB VERB ADV ADP PART DET ADV VERB NOUN PRON VERB ADJ DET NOUN PART DET VERB VERB ADP PRON VERB VERB VERB ADP NOUN NOUN PUNCT	fon
Yɛ̌n ɔ́ dídó ká ná zɔ́n bɔ è ná gɔn walɔ ɖagbe è ɖó bó nyì alɔ nú azɔnkwín ɔ́ ɖó ǎ " Benjamin Hùnkpátín wɛ́ ɖɔ mɔ̌ .	PRON DET VERB ADV VERB VERB CCONJ PRON VERB VERB NOUN ADJ PRON VERB ADP VERB NOUN ADP NOUN DET AUX PART PUNCT PROPN PROPN VERB VERB ADV PUNCT	fon
Kpá globoto è è sí bó ná nyì alɔ nú azɔnkwín ɔ́ " è ná vún í ɖò azǎn 11ɔ́ nǔxwásùn xwè 2020ɔ́ tɔn gbè " amɔ̌ za li xá azɔnkwín ɔ́ sín walɔ lɛ́ɛ kpó ɖòtè tɛgbɛ .	NOUN NOUN PRON PRON VERB ADP VERB VERB NOUN ADP NOUN DET PUNCT PRON VERB VERB ADP VERB NOUN NUM PROPN NOUN NUM ADJ NOUN PUNCT CCONJ VERB VERB VERB NOUN DET ADP NOUN DET CCONJ ADV NOUN PUNCT	fon
Ɖò kplé è gǎn - hɔn - yì - tɔ́ lɛ́ɛ yì é dó ɔ́ " ye sɔ́ gbetakɛ́n ɖɔ mɛ ɖokpó ɖokpó ní jɛ nǔ è nɔ́ ko wá ɖayǐ é wú kpɛɖé kpɛɖé " bó ká xwédó zali xá azɔnkwín sín walɔ lɛ́ɛ .	ADP VERB PRON NOUN PUNCT VERB PUNCT VERB PUNCT ADJ DET VERB PRON VERB DET PUNCT PRON VERB VERB ADP PRON NUM NUM ADP VERB NOUN PRON VERB ADV VERB ADV PRON ADP ADV ADV PUNCT ADP ADV NOUN VERB ADV NOUN ADP NOUN DET PUNCT	fon
Kpá globoto è è sí bó sɔ́ ɖayǐ ɖò azǎn 30ɔ́ xwèjísùn ɔ́ tɔn ɔ́ " azɔn we wɛ è lɛ́ sísɛ́ dó nukɔn " bɛ́ gbɔn tokpɔnla afɔtɔn mɛ̀ ;	NOUN NOUN PRON PRON VERB ADP VERB ADV ADP NOUN NUM PROPN DET ADJ DET PUNCT NOUN NUM VERB PRON DET VERB VERB ADJ PUNCT CCONJ ADP NOUN NUM ADP PUNCT	fon
è ná hùn nǔ sín élɔ́ nù kpɛɖé kpɛɖé .	PRON VERB VERB NOUN ADP ADJ ADP ADV ADV PUNCT	fon
Gbetakɛ́n nɛ́ ná dalɔ tò ɔ́ bɔ ajɔ̌ lɛ́ɛ ná bɛ́ bɔ nǔ wà lóbó mɔ kwɛ́ ná bɛ́ " bɔ mɛ ɖokpó ɖokpó ná lɛ́ jɛ éɖee sí .	NOUN ADJ VERB VERB NOUN DET CCONJ NOUN DET VERB VERB CCONJ NOUN VERB CCONJ VERB ADV VERB VERB PUNCT CCONJ NOUN NUM NUM VERB DET VERB PRON ADP PUNCT	fon
Acɛkpìkpà síxú gɔn tòví lɛ́ɛ cɔ́ ɖò azɔnkwín nɛ́ lí nù ǎ " mɔ̌ wú wɛ é ɖɔ émí ná gbéjé lanmɛ nú agùn Kplékplé ée ɖò wɛn nú azɔnkwín nɛ́ é bǐ .	NOUN VERB VERB NOUN DET VERB ADP NOUN ADJ ADP ADP PART PUNCT NOUN ADP VERB PRON VERB PRON VERB VERB NOUN ADP NOUN NOUN PRON VERB ADP ADP NOUN ADJ PART ADJ PUNCT	fon
Yɛ yíyí : William Yémalin Tchoki Maurice Thantan .	PRON VERB PUNCT PROPN PROPN NOUN PROPN PROPN PUNCT	fon
Gǎn ée ɖɔ̀nǔ dó gbaví nukpɛ́nnɔ gɔnu lɛ́ɛ " gbaví bowun bowun lɛ́ɛ kpódó wɛn jíjlá kpán nù ɔ́ ( HAAC ) "	NOUN PRON VERB ADP NOUN NOUN NOUN DET PUNCT NOUN PROPN ADV DET CCONJ NOUN NOUN CCONJ ADP DET PUNCT PROPN PUNCT PUNCT	fon
ɖè ɖɔ nú è sè ɖé tɔ́n ɖò azǎn 7ɔ́ lyasùn xwè 2020ɔ́ tɔn gbè " bó nyì gbehwan mɛ ée nɔ́ wà xó jíjlá zɔ́ ɖò mɔkàn jí bɔ è má ná gbè tɔn yě ǎ lɛ́ɛ ɖɔ ye ní ɖó azɔ̌ yetɔn tè .	VERB VERB ADP PRON VERB ADV ADJ ADP NOUN NUM PROPN NOUN NUM ADJ NOUN PUNCT ADP AUX NOUN PRON PRON VERB VERB NOUN NOUN ADV ADP NOUN ADP CCONJ PRON VERB VERB NOUN ADJ PRON PART DET SCONJ PRON AUX VERB NOUN ADJ ADP PUNCT	fon
Xó jíjlá zɔ́ wá tɔ́ gbɔn mɔkàn jí tɔ́ ée ɖò Benɛ tò mɛ̀ lɛ́ɛ ɔ́ " ényí ye má xwédó nǔzɔnmɛ HAAC tɔn ǎ ɔ́ " è ná jɛ gǒ mɛ̀ nú yě .	NOUN NOUN ADV VERB ADJ ADP NOUN ADP ADJ PRON VERB PROPN NOUN ADP DET DET PUNCT SCONJ PRON VERB VERB NOUN PROPN ADJ PART DET PUNCT PRON VERB VERB PART ADP ADP PRON PUNCT	fon
Cóbónú gbehwan nyì mɛ nɛ́ ná tɔ́n sín HAAC nù mɛ̀ ɔ́ " xó jíjlá gbɔn mɔkàn jí sín azɔxwé	SCONJ NOUN AUX NOUN ADJ VERB VERB ADP PROPN ADP ADP DET PUNCT VERB VERB ADP NOUN ADP ADP NOUN	fon
wɛ mɛ lɛ́ɛ tó ɖò hùnhùn agbafafa má byɔ gbè hwɛ̌ .	VERB PRON DET VERB VERB NOUN NOUN VERB VERB NOUN ADV PUNCT	fon
Mɛ ée tlɛ ko ɖó gbaví nukpɛ́nnɔ gɔnu alǒ gbaví bowun bowun gɔnu kpáa lɛ́ɛ ɔ́ " cóbónú ye ná sɔ̀ dó mɔkàn jí ɔ́ " sɛ́n è ná xwédó bɔ HAAC ná tó ná gbè tɔn hwɛ̌ ɔ́ ɖye :	NOUN PRON VERB ADV VERB NOUN ADJ NOUN CCONJ NOUN VERB ADV NOUN ADJ DET DET PUNCT NOUN PRON VERB VERB ADP NOUN ADP DET PUNCT NOUN PRON VERB VERB CCONJ PROPN VERB VERB VERB NOUN ADJ ADV DET PART PUNCT	fon
 Xó jlá zɔ́ wíwá gbɔn mɔkàn jí alɔkpa ɖěbǔ ɖò Benɛ tò ɔ́  é síxú nyí vɔ̌nu alǒ è nɔ́ bló bó nɔ́ yí kwɛ́ " HAAC wɛ́ ná tó ná gbè tɔn hwɛ̌ .	PUNCT NOUN VERB VERB NOUN ADP NOUN ADP NOUN ADV ADP PROPN NOUN DET PUNCT PRON VERB AUX VERB CCONJ PRON VERB VERB ADP VERB VERB VERB PUNCT PROPN VERB VERB ADV VERB NOUN ADJ ADV PUNCT	fon
 Sɛ́nkwín ée ɖɔ̀nǔ dé nù ɔ́  xixa tɔn ɖye : sɛ́nkwín 252ɔ́ sɛ́n 2015 - 7 azǎn 20 xwèjísùn xwè 2015ɔ́ tɔn bɛ́ kɛnu dó wɛn jíjlá zɔ́ ɔ́ wú .	PUNCT NOUN PRON VERB VERB ADP DET PUNCT NOUN ADJ ADJ PUNCT NOUN ADJ NOUN NUM PUNCT NUM NOUN NUM PROPN NOUN NUM ADJ CCONJ NOUN ADP VERB VERB ADV DET ADP PUNCT	fon
Ɖò mɔkàn è gbàkún ɔ́ sín ali nù ɔ́ " xó jíjlá gbɔn mɔkàn jí gɔnu lɛ́ɛ sukpɔ́ ɖò xó jíjlá lí nù ɖò Benɛ tò mɛ̀ .	ADP NOUN PRON VERB DET ADV NOUN ADP DET PUNCT NOUN VERB ADV NOUN ADP NOUN DET ADV ADP NOUN VERB ADP ADP ADP PROPN NOUN ADP PUNCT	fon
Nǔ è nylá ɖémɛ ɔ́ wɛ́ nyí ɖɔ xó jlá zɔ́ gbɔn mɔkàn jí agbafafa nɛ́ ɔ́ nɔ́ xwédó sɛ́n hwe bǐ nù ǎ .	NOUN PRON AUX ADV DET VERB AUX VERB VERB ADV VERB ADP NOUN ADP NOUN ADJ DET VERB VERB NOUN NOUN ADJ ADP PART PUNCT	fon
Bɔ bɛsín xwè mɔkpán ɖye ɖokpóo ɔ́ " sɛ́n jɛn HAAC nɔ́ flín yemɛ ée ɖò xó jíjlá gɔnu yaɖé yaɖé hùn wɛ lɛ́ɛ é .	ADJ VERB NOUN ADJ DET ADV DET PUNCT NOUN ADP PROPN VERB VERB PRON PRON VERB NOUN ADP NOUN ADJ ADJ VERB ADP DET PART PUNCT	fon
Ɖò azǎn yɔywɛ ɖé mɛ̀ din ɔ́ " Benɛ tò ɔ́ ná ɖù ablɔɖe tɔn sín xwè 60ɔ́ ɖò awăjíjɛ́ ɖé mɛ̀ .	ADP NOUN VERB DET ADP ADV DET PUNCT PROPN NOUN DET VERB VERB NOUN ADJ ADP NOUN NUM ADP NOUN DET ADP PUNCT	fon
Angélique Kijo ko ɖù xwè kpé xwè nù tɔn 60ɔ́ bɛ́ nyí nǔ ɖé bó flá gbɛ ɔ́ bǐ jí .	NOUN PROPN ADV VERB NOUN VERB NOUN ADP ADJ NUM VERB AUX NOUN ADJ ADP VERB NOUN DET ADJ ADP PUNCT	fon
Hwenu hansinɔ tewungbeju ɔ́ ɖò xwè kpé xwè nù tɔn 60ɔ́ ɖù wɛ ɔ́ " mɛ ée nɔ́ ko wlán nǔ gbɔn mɔkàn jí lɛ́ɛ é bǐ wɛ́ sɔ́ ɛ́ sù .	NOUN NOUN NOUN DET ADP NOUN VERB NOUN ADP ADJ NUM ADV PART DET PUNCT NOUN PRON VERB ADV VERB NOUN ADP NOUN ADP DET PRON ADJ VERB VERB ADV VERB PUNCT	fon
Amɔ̌ nǔ è hɛn hǔn ɔ́ wɛ́ nyí sɔ́ è hansinɔ tɔnjɛji gbɛ ɔ́ tɔn ɛnɛ " Grammy's Award " tɔn lɛ́ɛ sɔ́ ɛ́ sù é .	CCONJ NOUN PRON VERB NOUN DET VERB AUX VERB PRON NOUN VERB NOUN DET ADJ ADP PUNCT PROPN PROPN PUNCT ADJ DET VERB ADV VERB PART PUNCT	fon
Gosin Awɔnlin wá yì États - Unis ɔ́ " bó gosin Paris wá yì Johannesburg ɔ́ " xɔntɔn tɔn lɛ́ɛ jihan bó sɔ́ ɛ́ sù .	NOUN NOUN VERB VERB PROPN PUNCT PROPN DET PUNCT ADP NOUN PROPN VERB VERB PROPN DET PUNCT NOUN ADJ DET VERB ADP VERB PRON VERB PUNCT	fon
Fúfónu ɔ́ : cɛ́jú 20 sín han ji ɖò nukpɛ́n mɛ̀ wɛ è xò kplé ; Alicia Keys ɖémɛ " Salif Kéïta ɖémɛ " Baaba Mall ɖémɛ bɔ Burna Boy lɔ́ɔ ɖémɛ bɔ ye bǐ ji han lóbó byɔ́ ɖagbe níí .	NOUN DET PUNCT ADV NUM ADV NOUN ADV ADP NOUN ADP VERB PRON VERB VERB PUNCT PROPN PROPN ADV PUNCT PROPN ADV ADV PUNCT PROPN PROPN ADV CCONJ PROPN PROPN ADV ADV CCONJ PRON ADJ ADV ADV CCONJ VERB VERB ADP PUNCT	fon
É víví bó sɔ́ akpàkpà mɛ .	PRON ADV ADP VERB NOUN PRON PUNCT	fon
Jean Michel Kasbarian ée nyí wěɖéxamɛtɔ́ ɖò ɖò hwɛndo nǔwíwá lɛ́ɛ lí nù ɖò afɔ sɔ́ ɖótè xwé flansée lɛ́ɛ tɔn ée ɖò Benɛ yíkúngban jí ɔ́ " wlán nǔ dó Facebook jí bó dó é yì xwè ɖè xó gbè sɛ́dó (NUM)ɛsɛn tò ɔ́ tɔn lɛ́ɛ .	PROPN PROPN PROPN PRON AUX NOUN ADP ADP VERB NOUN DET ADP ADP ADP NOUN VERB NOUN NOUN ADJ DET ADJ PRON VERB PROPN VERB ADP DET PUNCT NOUN NOUN ADP PROPN ADP ADP VERB PRON VERB NOUN ADP VERB NOUN VERB NOUN NOUN DET ADJ DET PUNCT	fon
Nǔ fyan mɛ dó ɖagbe jí kɛɖɛ .	NOUN VERB PRON VERB ADV ADP VERB PUNCT	fon
